{
  "workspaceId": "workspace_demo",
  "configId": "config_demo",
  "version": "1",
  "directContributorIds": ["contributor_owner"],
  "icpRuleSet": {
    "ruleSetId": "rules_icp",
    "version": "1",
    "mode": "all",
    "rules": [
      {
        "ruleId": "rule_industry",
        "field": "industry",
        "operator": "in",
        "value": ["software"],
        "required": true,
        "weight": 100
      }
    ]
  },
  "stakeholderPersonaRuleSet": {
    "ruleSetId": "rules_persona",
    "version": "1",
    "mode": "all",
    "rules": [
      {
        "ruleId": "rule_function",
        "field": "function",
        "operator": "in",
        "value": ["sales"],
        "required": true,
        "weight": 50
      },
      {
        "ruleId": "rule_seniority",
        "field": "seniority",
        "operator": "in",
        "value": ["vp"],
        "required": true,
        "weight": 50
      }
    ]
  },
  "coachCandidateRuleSet": {
    "ruleSetId": "rules_coach",
    "version": "1",
    "mode": "any",
    "rules": [
      {
        "ruleId": "rule_function_exists",
        "field": "function",
        "operator": "exists",
        "value": true,
        "required": true,
        "weight": 100
      }
    ]
  },
  "targetAccounts": [
    {
      "targetAccountId": "target_northstar",
      "organizationId": "org_northstar",
      "priority": 1,
      "attributes": {
        "industry": "software",
        "domain": "northstar.example.com"
      }
    }
  ],
  "accountProfiles": [
    {
      "organizationId": "org_lantern",
      "attributes": { "industry": "software", "domain": "lantern.example.com" }
    },
    {
      "organizationId": "org_northstar",
      "attributes": {
        "industry": "software",
        "domain": "northstar.example.com"
      }
    }
  ],
  "approvedOrganizationAliases": [],
  "scoring": {
    "weights": {
      "accountFit": 25,
      "personaFit": 20,
      "relationshipConfidence": 20,
      "employmentConfidence": 15,
      "pathConfidence": 10,
      "freshness": 10
    },
    "personaMatchedThreshold": 100,
    "uncertainLowerBound": 50
  },
  "freshness": {
    "currentEmploymentMaxDays": 365,
    "reviewEmploymentMaxDays": 730,
    "relationshipMaxDays": 365
  },
  "suppressions": [],
  "exclusions": [],
  "reviewPolicy": {
    "uncertainPersona": "review_only_candidate",
    "staleEmployment": "review_only",
    "unresolvedIdentity": "block",
    "unresolvedOrganization": "block",
    "bAndDRequireReview": true,
    "reviewReasonCode": "HUMAN_REVIEW_REQUIRED"
  }
}
